{
  "$schema": "https://json-schema.org/draft/2020-12/schema",
  "$id": "https://discoveryathome.org/schema/v0/registry-entry.schema.json",
  "title": "Hub registry entry (registry/projects/<slug>.json)",
  "type": "object",
  "required": ["repos", "added_on"],
  "additionalProperties": false,
  "properties": {
    "repos": {
      "type": "array", "minItems": 1,
      "description": "The project's repositories. The first is its home: entry chain, frontier and consent record live there. The file name is the project ID.",
      "items": {
        "type": "object", "required": ["repo"],
        "properties": {
          "repo": { "type": "string", "pattern": "^[A-Za-z0-9_.-]+/[A-Za-z0-9_.-]+$", "description": "GitHub owner/name." },
          "path": { "type": "string", "description": "Subdirectory, when the repo holds more than one project." },
          "ref": { "type": "string", "description": "Branch to read. Default: the repo's default branch (HEAD)." },
          "role": { "type": "string", "description": "What this repo is for, in plain words, when there are several." }
        }
      }
    },
    "added_on": { "type": "string", "format": "date" },
    "contact": { "type": "string", "description": "GitHub handle of the maintainer who requested listing." },
    "adapter": { "type": "string", "pattern": "^adapters/[a-z0-9-]+\\.md$", "description": "The project's adapter (spec §12.5): a Markdown file in the hub repo, adapters/<project-id>.md, for donors' agents, with a machine-readable block that replaces overlay and frontier_adapter." },
    "overlay": {
      "type": "object",
      "description": "Deprecated: put it in the adapter file. A manifest used only while the repo has no discover.json of its own. Same shape as discover.json."
    },
    "frontier_adapter": {
      "type": "object",
      "description": "Deprecated: put it in the adapter file. Maps a pre-v0 frontier record onto v0 fields: {v0_field: raw_field}, plus metric {name, value, decimal, direction} and evidence_level (declared)."
    },
    "process_changed_on": { "type": "string", "format": "date", "description": "As in the manifest, for repos listed through an adapter." },
    "assessment": { "type": "string", "description": "Path of the latest assessment record, e.g. assessments/<id>/<date>-<assessor>.md." },
    "stage": { "enum": ["assessed", 0, 1, 2], "description": "The stage computed in that assessment (spec §3.3), copied here when a hub maintainer merges it. Absent: not yet assessed." },
    "grades": { "$ref": "#/$defs/grades" },
    "intake": { "type": "string", "description": "URL of the hub issue the entry came from." },
    "nomination": {
      "type": "object", "required": ["by", "on"],
      "description": "Present when someone other than a maintainer nominated the project (spec §11.5). A nominated project is catalogued without a launcher until a consent record lists this hub.",
      "properties": {
        "by": { "type": "string", "description": "GitHub handle of the nominator." },
        "on": { "type": "string", "format": "date" },
        "proposal": { "type": "string", "description": "URL of the issue on the project proposing setup, if any." },
        "draft": { "type": "string", "description": "URL of a branch holding drafted setup files, if any." }
      }
    },
    "projected": {
      "type": "object",
      "description": "The assessment if the proposed setup were adopted with consent: what the project would look like after setup. Breadcrumb: nomination.proposal.",
      "properties": {
        "assessment": { "type": "string" },
        "stage": { "enum": ["assessed", 0, 1, 2] },
        "grades": { "$ref": "#/$defs/grades" }
      }
    },
    "consent": {
      "type": "object",
      "description": "What the hub last verified from the project's consent record (spec §11.4).",
      "properties": {
        "source": { "type": "string", "description": "Path of the record, or 'application' for consent by submitting or approving the registry PR." },
        "commit": { "type": "string" },
        "checked_on": { "type": "string", "format": "date" },
        "list": { "type": "boolean" },
        "push": { "type": "array", "items": { "enum": ["notices", "suggestions", "prs"] } }
      }
    },
    "credit": {
      "type": "object", "required": ["policy"],
      "properties": { "policy": { "type": "string" }, "kinds": { "type": "array", "items": { "type": "string" } } }
    },
    "featured": { "type": "boolean", "default": false }
  },
  "$defs": {
    "grade": { "enum": ["strong", "adequate", "weak", "unknown"] },
    "grades": {
      "type": "object", "additionalProperties": false,
      "description": "Per-property grades from the assessment (spec §3.2).",
      "properties": {
        "orientation": { "$ref": "#/$defs/grade" }, "coordination": { "$ref": "#/$defs/grade" },
        "verification": { "$ref": "#/$defs/grade" }, "review": { "$ref": "#/$defs/grade" },
        "steering": { "$ref": "#/$defs/grade" }
      }
    }
  }
}
