{
  "repos": [
    {
      "repo": "discoveryathome/antenna-array"
    }
  ],
  "added_on": "2026-10-21",
  "contact": "Mister-Meeseeks",
  "assessment": "assessments/antenna-array/2026-10-21-claude.md",
  "stage": 1,
  "grades": {
    "orientation": "strong",
    "coordination": "adequate",
    "verification": "adequate",
    "review": "adequate",
    "steering": "adequate"
  },
  "consent": {
    "source": "discover.json",
    "commit": "d82123d8c1b75da11da7d58ea9ce7ad219791d60",
    "checked_on": "2026-10-21",
    "list": true,
    "push": []
  },
  "credit": {
    "policy": "Credit specific implementations, checks and reviews in CONTRIBUTORS.md by consent; no automatic coauthorship. Agent-authored initial pilot is disclosed.",
    "kinds": ["contributors-file", "acknowledgement"]
  },
  "featured": false
}
