{
  "repos": [
    {
      "repo": "discoveryathome/genomic-sequence-indexing"
    }
  ],
  "added_on": "2026-10-22",
  "contact": "Mister-Meeseeks",
  "assessment": "assessments/genomic-sequence-indexing/2026-10-22-claude.md",
  "stage": 1,
  "grades": {
    "orientation": "strong",
    "coordination": "adequate",
    "verification": "adequate",
    "review": "adequate",
    "steering": "adequate"
  },
  "consent": {
    "source": "discover.json",
    "commit": "0d09671f10a05a7d01316977d9826468b1862b0f",
    "checked_on": "2026-10-22",
    "list": true,
    "push": []
  },
  "credit": {
    "policy": "Credit upstream methods/data and all substantive contributors; disclose AI assistance."
  },
  "featured": false
}
