{
  "repos": [
    {
      "repo": "discoveryathome/zk-gadgets"
    }
  ],
  "added_on": "2026-10-21",
  "contact": "Mister-Meeseeks",
  "assessment": "assessments/zk-gadgets/2026-10-21-claude.md",
  "stage": 1,
  "grades": {
    "orientation": "strong",
    "coordination": "adequate",
    "verification": "adequate",
    "review": "adequate",
    "steering": "adequate"
  },
  "consent": {
    "source": "discover.json",
    "commit": "5e7f02950e4c894ca3c9329dc8956fa48e13fb60",
    "checked_on": "2026-10-21",
    "list": true,
    "push": []
  },
  "credit": {
    "policy": "Credit named contributions and independent reviews in CONTRIBUTORS.md; cite upstream sources. No automatic authorship claims.",
    "kinds": ["contributors-file", "citation"]
  },
  "featured": false
}
