{
  "repos": [
    {
      "repo": "discoveryathome/bridge-truss"
    }
  ],
  "added_on": "2026-10-21",
  "contact": "Mister-Meeseeks",
  "assessment": "assessments/bridge-truss/2026-10-21-claude.md",
  "stage": 1,
  "grades": {
    "orientation": "strong",
    "coordination": "adequate",
    "verification": "adequate",
    "review": "adequate",
    "steering": "adequate"
  },
  "consent": {
    "source": "discover.json",
    "commit": "d3a2a3da00c7cb329474470f9e112f0ac0d32cb1",
    "checked_on": "2026-10-21",
    "list": true,
    "push": []
  },
  "credit": {
    "policy": "Record consenting contributors and reviewers in CONTRIBUTORS.md and result packages; cite benchmark authors; disclose AI assistance; no automatic paper authorship.",
    "kinds": ["contributors-file", "citation", "acknowledgement"]
  },
  "featured": false
}
